[
  {
    "title": "The Shawshank Redemption",
    "year": 1994,
    "provider": "apple",
    "imdbId": "tt0111161",
    "posterUrl": "https://image.tmdb.org/t/p/w300/q6y0Go1tsGEsmtFryDOJo3dEmqu.jpg",
    "plot": "Imprisoned in the 1940s for the double murder of his wife and her lover, upstanding banker Andy Dufresne begins a new life at the Shawshank prison, where he puts his accounting skills to work for an amoral warden. During his long stretch in prison, Dufresne comes to be admired by the other inmates for his integrity and unquenchable sense of hope.",
    "imdbRating": 9.3,
    "runtime": 142,
    "genres": ["Drama", "Crime"]
  },
  {
    "title": "The Godfather",
    "year": 1972,
    "provider": "bluray",
    "imdbId": "tt0068646",
    "posterUrl": "https://image.tmdb.org/t/p/w300/3bhkrj58Vtu7enYsRolD1fZdja1.jpg",
    "plot": "The aging patriarch of an organized crime dynasty transfers control of his clandestine empire to his reluctant son.",
    "imdbRating": 9.2,
    "runtime": 175,
    "genres": ["Drama", "Crime"]
  },
  {
    "title": "12 Angry Men",
    "year": 1957,
    "provider": "dvd",
    "imdbId": "tt0050083",
    "posterUrl": "https://image.tmdb.org/t/p/w300/ow3wq89wM8qd5X7hWKxiRfsFf9C.jpg",
    "plot": "The jury in a New York City murder trial is frustrated by a single member whose skeptical caution forces them to more carefully consider the evidence before jumping to a hasty verdict.",
    "imdbRating": 9.0,
    "runtime": 96,
    "genres": ["Drama", "Crime"]
  }
]
